{"$defs":{"ParseBenchCandidate":{"additionalProperties":false,"properties":{"item_id":{"minLength":1,"title":"Item Id","type":"string"},"page_number":{"exclusiveMinimum":0,"title":"Page Number","type":"integer"},"source_digest":{"anyOf":[{"pattern":"^sha256:[0-9a-f]{64}$","type":"string"},{"type":"null"}],"default":null,"title":"Source Digest"},"source_document_id":{"minLength":1,"title":"Source Document Id","type":"string"},"source_path":{"minLength":1,"title":"Source Path","type":"string"},"strata":{"items":{"$ref":"#/$defs/ParseBenchStratum"},"minItems":1,"title":"Strata","type":"array"}},"required":["item_id","source_document_id","page_number","source_path","strata"],"title":"ParseBenchCandidate","type":"object"},"ParseBenchStratum":{"enum":["hard-table","merged-cells","ocr-scan","multicolumn","difficult-layout","numeric-financial","bilingual-multilingual"],"title":"ParseBenchStratum","type":"string"},"SubsetSelectionStatus":{"enum":["UNPROVISIONED","FROZEN"],"title":"SubsetSelectionStatus","type":"string"}},"$id":"https://schemas.docparser.example/evaluation/parsebench-subset-v1.json","$schema":"https://json-schema.org/draft/2020-12/schema","additionalProperties":false,"properties":{"access_policy":{"minLength":1,"title":"Access Policy","type":"string"},"candidate_id_ordering":{"default":"sha256(seed:item_id),item_id","minLength":1,"title":"Candidate Id Ordering","type":"string"},"dataset_id":{"minLength":1,"title":"Dataset Id","type":"string"},"manifest_version":{"default":"1.0.0","minLength":1,"title":"Manifest Version","type":"string"},"seed":{"minimum":0,"title":"Seed","type":"integer"},"selected_item_digest":{"pattern":"^sha256:[0-9a-f]{64}$","title":"Selected Item Digest","type":"string"},"selected_items":{"items":{"$ref":"#/$defs/ParseBenchCandidate"},"title":"Selected Items","type":"array"},"selection_script_version":{"default":"parsebench-complex-selector@1.0.0","minLength":1,"title":"Selection Script Version","type":"string"},"selection_status":{"$ref":"#/$defs/SubsetSelectionStatus"},"split":{"enum":["DEVELOPMENT","PROTECTED_HOLDOUT"],"title":"Split","type":"string"},"target_count":{"exclusiveMinimum":0,"title":"Target Count","type":"integer"},"upstream_repository":{"default":"llamaindex/ParseBench","minLength":1,"title":"Upstream Repository","type":"string"},"upstream_revision":{"default":"57fb218011ac95a628ddefacecda8010343ca0a6","minLength":1,"title":"Upstream Revision","type":"string"}},"required":["dataset_id","split","selection_status","seed","target_count","selected_items","selected_item_digest","access_policy"],"title":"ParseBenchSubsetManifest","type":"object"}
